{
  "id": "claim-nestle-water-cjipe",
  "subject_entity_id": "nestle",
  "statement": "En septembre 2024, Nestlé Waters Supply Est a conclu une convention judiciaire d'intérêt public environnementale avec le parquet d'Épinal, assortie d'une amende d'intérêt public de deux millions d'euros.",
  "topic": "business_consumption",
  "claim_status": "not_reviewed",
  "valid_from": "2024-09-02",
  "valid_until": null,
  "source_ids": [
    "source-justice-2024-cjipe-nestle",
    "source-nestle-2024-reponse-cjipe"
  ],
  "evidence_ids": [
    "evidence-nestle-water-cjipe",
    "evidence-nestle-water-cjipe-fine"
  ],
  "reviewed_at": null,
  "uncertainty_note": "La convention concerne Nestlé Waters Supply Est et les faits relevant de son périmètre dans les Vosges. Elle ne doit pas être présentée comme une condamnation de l'ensemble du groupe Nestlé.",
  "editorial_note": "Présenter la nature exacte de la convention et ses limites de périmètre ; ne pas la confondre avec une condamnation pénale de toutes les entités du groupe."
}
